line,text_a,text_b,item_a,prosodel_a,lexel_a,grammel_a,item_b,prosodel_b,lexel_b,grammel_b,notes
230,Go þou most to þi wyf,gete þou most nede,wyf,nontrochaic,MED52688,n<pr,nede,trochaic,MED29186,av,
231,A child Galaad schal be hoten,þat goodnesse schal reise,hoten,trochaic,MED21307,vSpp,reise,trochaic,MED36573,vi,
232,þe Auenturus of Brutayne,to haunsen and to holden,Brutayne,trochaic,Wikidata_Q3240725,n<pr,holden,trochaic,MED20995,vi,
233,And he dos as he bad,and to his bed buskes,bad,nontrochaic,MED4381,vSpt13,buskes,trochaic,MED6383,vps13,
234,¶ In þe morwe he was vppe,and roises þis oþure,vppe,trochaic,MED50323,av,oþure,trochaic,MED31010,pn-defOd,
235,þenne hit þester bi-gon,and þonderde swiþe,bi-gon,nontrochaic,MED4470,vSpt13,swiþe,trochaic,MED44277,av,
236,þat þe graue quakede,and þei a-grisen alle,quakede,trochaic,MED35409,vpt13,alle,trochaic,MED985,ajpl,
237,¶ He bi-þenkes him þo,and to his whucche weendes,þo,nontrochaic,MED45360,av,weendes,trochaic,MED52201,vps13,
238,And feole preiers he made,þat Ihesu crist herde,made,trochaic,MED26584,vpt13,herde,trochaic,MED20505,vpt13,
239,And spekes to hem,wiþ loueliche wordes,hem,nontrochaic,MED20353,P23<pr,wordes,trochaic,MED53418,npl<pr,
240,¶ I-blesset be ȝe to day,alle myne leoue children,today,nontrochaic,MED46102,av,children,trochaic,MED7559,npl-voc,
241,And he tolde hem of his crucifiing,hou he [þe] cros souȝte,crucifiing,nontrochaic,MED9041,vn<pr,souȝte,trochaic,MED39128,vpt13,
242,And of heore fadres bi-fore,þat he fond vn-kuynde,bi-fore,trochaic,MED4432,av,vnkuynde,trochaic,MED49020,ajplOd,
243,Er þei speeken to me feire,and faynede me wiþ wordes,feire,trochaic,MED15160,av,wordes,trochaic,MED53418,npl<pr,
244,Bote þei hateden me,and hedden de-deyn,me,nontrochaic,MED27132,P11Od,dedeyn,trochaic,MED11889,nOd,
245,Bote beo ȝe stable in oure fei,and foleweþ vre werkes,fei,dative_e,MED15481,n<pr,werkes,trochaic,MED52278,nplOd,
246,for ȝe han more of þe lawe,þen prophetes hedden,lawe,trochaic,MED24815,n<pr,hedden,trochaic,MED20173,vpt23,
247,¶ Þei nedden bote þe holygost,and so ȝe han eke,holy gost,nontrochaic,MED21027,nOd,eke,trochaic,MED13182,av,
248,and siþen bodiliche me,to ben at or wille,me,nontrochaic,MED27132,P11Od,wille,trochaic,MED52793,n<pr,
249,¶ I nul not fastenen on þe sone,þe Fadres gultus,sone,trochaic,MED41557,n<pr,gultus,trochaic,MED18577,nplOd,
250,I for-ȝiue ow clene,þe harm þat I hedde,clene,trochaic,MED7951,av,hedde,trochaic,MED20173,vpt11,
251,And cum þou hider Iosaphe,for þou art Iugget clene,Iosaphe,trochaic,Wikidata_Q6288522,n-voc,clene,trochaic,MED7950,aj,
252,And art digne þer-to,þat dos me to lyke,þer-to,nontrochaic,MED45196,av,lyke,trochaic,MED25553,vi-m,
253,Ichul bi-take þe to-day,in a good tyme,today,nontrochaic,MED46102,av,tyme,trochaic,MED45871,n<pr,
254,on þe hiȝeste þing,holden on eorþe,þing,nontrochaic,MED45301,nOd,eorþe,trochaic,MED14387,n<pr,
255,non oþer of me,hit murili to habben,me,nontrochaic,MED27132,P11<pr,habben,trochaic,MED20173,vi-m,
256,but elles vche mon of þe,þat takes hit aftur,þe,nontrochaic,MED45072,P12<pr,aftur,trochaic,MED801,av,
257,He bad him lifte vp,and þe lide warpes,vp,nontrochaic,MED50323,av,warpes,trochaic,MED52306,vps13,
258,Þenne he seos Ihesu crist,in a sad Roode,crist,nontrochaic,MED10361,nOd,Roode,trochaic,MED37732,n<pr,MED sense 2b
259,and his fyue Angeles,þat forþ wiþ him stoden,Angeles,trochaic,MED3046,nplOd,stoden,trochaic,MED43062,vSpt23,
260,As red as þe fuir,and he hem bi-holdes,fuir,nontrochaic,MED16036,n,bi-holdes,trochaic,MED4526,vps13,
261,¶ þat on beres in his hond,a cros of queynte hewe,hond,dative_e,MED21102,n<pr,hewe,dative_e,MED20681,n<pr,
262,¶ þat oþer beres in his hond,þreo blodi nayles,hond,dative_e,MED21102,n<pr,nayles,trochaic,MED29017,nplOd,
263,¶ þe þridde þe Coroune,þat his hed keuerde,Coroune,trochaic,MED9794,nOd,keuerde,trochaic,MED10112,vpt13,
264,¶ þe Feorþe þe launce,þat lemede him wiþ-Inne,launce,trochaic,MED24845,nOd,wiþ-Inne,trochaic,MED53079,av,
265,¶ And þe Fyfþe a blodi cloþ,þat he was inne i-braced,cloþ,nontrochaic,MED8138,nOd,i-braced,trochaic,MED5769,vpp,
266,whon he lay after slauht,in þe sepulcre,slauht,dative_e,MED40780,n<pr,sepulcre,trochaic,MED39477,n<pr,
267,¶ þenne he falles for fere,forþ wiþ þe wȝucche,fere,dative_e,MED15618,n<pr,wȝucche,trochaic,MED52535,n<pr,
268,Eft he bad him rise vp,he ros wiþ þe bone,vp,nontrochaic,MED50323,av,bone,trochaic,MED5478,n<pr,
269,¶ þenne he sauh Ihesu crist,I-strauȝt vppon þe Roode,crist,nontrochaic,MED10361,nOd,Roode,trochaic,MED37732,n<pr,
270,whuche þe Angel by-fore,hedde in his hond,by-fore,trochaic,MED4432,av,hond,dative_e,MED21102,n<pr,
271,And þe þreo nayles,þat þe oþur bi-foren hedde,nayles,trochaic,MED29017,nplOd,hedde,trochaic,MED20173,vpt13,
272,In his honden and his feet,alle þei weore faste,feet,nontrochaic,MED17401,npl<pr,faste,trochaic,MED15312,ajpl,
273,¶ Siþen stiken wiþ þe spere,blod and watur louses,spere,trochaic,MED42136,n<pr,louses,trochaic,MED26123,vps13,
274,Bi-holdes touward hise feet,say fro hem renne,feet,nontrochaic,MED17401,npl<pr,renne,trochaic,MED36797,vi,
275,eornen al of red blod,romynge a-boute,blod,nontrochaic,MED5268,n<pr,a-boute,trochaic,MED160,av,
276,Al priueliche his peyne,a-pertliche he sauh,peyne,trochaic,MED32728,nOd,sauh,nontrochaic,MED39393,vSpt13,
277,WHi lengest þou quod Iosep[h],to his sone so longe,Iosep,nonschwa,Wikidata_Q271474,n,longe,trochaic,MED26029,av,
278,And so stille liggest,lokynde in þe whucche,liggest,trochaic,MED25443,vps12,whucche,trochaic,MED52535,n<pr,
279,A Fader touche me not,in þis ilke tyme,not,nontrochaic,MED29867,av,tyme,trochaic,MED45871,n<pr,
280,For muche gostliche grace,me is here I-graunted,grace,trochaic,MED19175,nOd,graunted,trochaic,MED19274,vpp,
281,¶ þenne þei loken in atte wȝucche,loueliche boþe,wȝucche,trochaic,MED52535,n<pr,boþe,trochaic,MED5636,ajpl,
282,¶ þenne þei seȝen Ihesu crist,in þat ilke foorme,crist,nontrochaic,MED10361,nOd,foorme,trochaic,MED17042,n<pr,
283,þat heo seȝen him sodeynliche,whon heo furst comen,sodeynliche,trochaic,MED41315,av,comen,trochaic,MED8522,vSpt23,
284,aftur þe slauȝt to him,to þe sepulcre,him,nontrochaic,MED20803,P13M<pr,sepulcre,trochaic,MED39477,n<pr,
285,¶ þenne comen two Angeles,wiþ twayles white,Angeles,trochaic,MED3046,npl,white,trochaic,MED52610,ajpl<pr,
286,And eiþer bar in his hond,a basyn of seluer,hond,dative_e,MED21102,n<pr,seluer,trochaic,MED40351,n<pr,
287,Oþur Tweyne aftur hem,with cruetes sone,hem,nontrochaic,MED20353,P23<pr,sone,trochaic,MED41559,av,
288,and wasscheles wiþ haly water,with hem þei brouȝten,water,trochaic,MED51881,n<pr,brouȝten,trochaic,MED6058,vpt23,
289,And oþer two after hem,with sencers soone,hem,nontrochaic,MED20353,P23<pr,soone,trochaic,MED41559,av,
290,set wiþ riche stones,and a viole of sence,stones,trochaic,MED43058,npl<pr,sence,dative_e,MED7080,n<pr,
291,¶ þen com on þe strengþe of god,gabriel I-hoten,god,trochaic,MED18945,n<pr,I-hoten,trochaic,MED21307,vSpp-aj,
292,wiþ þe riccheste sege,þat euer for seete seemes,sege,dative_e,MED39202,n<pr,seemes,trochaic,MED39359,vps13,
293,And oþer two after him,wiþ crois and wiþ Mitre,him,nontrochaic,MED20803,P13M<pr,Mitre,trochaic,MED28377,n<pr,
294,And oþure bouwynde after,wiþ vestimens sone,after,trochaic,MED801,av,sone,trochaic,MED41559,av,
295,HE seiȝ an Auter I-cloþed,wiþ cloþes ful riche,I-cloþed,trochaic,MED8140,vpp-aj,riche,trochaic,MED37439,ajpl<pr,
296,Vppon þat on ende lay,þe launce and þe nayles,lay,nontrochaic,MED25443,vSpt23,nayles,trochaic,MED29017,npl,
297,And vppon þat oþer ende,þe disch wiþ þe blode,ende,trochaic,MED13649,n<pr,blode,dative_e,MED5268,n<pr,
298,and a vessel of gold,geynliche bi-twene,gold,dative_e,MED19031,n<pr,bi-twene,trochaic,MED4992,av,
299,¶ Ihesu made for to greiþe Iosaphe,in þat geyn weede,Iosaphe,trochaic,Wikidata_Q6288522,nOd,weede,trochaic,MED51971,n<pr,
300,And sacrede him to Bisschop,wiþ boto his hondes,Bisschop,nonschwa,MED4803,n<pr,hondes,trochaic,MED21102,npl<pr,
301,And tolde him of his vestimens,what þei signefyen,vestimens,nontrochaic,MED51067,npl<pr,signefyen,trochaic,MED40276,vps23,
302,In vche Cite þere he come,sacren on he scholde,come,trochaic,MED8522,vsjps13,scholde,trochaic,MED40162,vpt13,
303,wiþ þe selue oygnemens,þat he to him wrouȝte,oygnemens,nontrochaic,MED30472,npl<pr,wrouȝte,trochaic,MED52280,vpt13,
304,And an-oyg[n]ten oþer kynges,þat to crist torneden,kynges,trochaic,MED24299,nplOd,torneden,trochaic,MED47404,vpt23,
305,¶ Ȝit he leres him more,loueliche him-seluen,more,trochaic,MED28626,ajnpl-cpv,seluen,trochaic,MED20373,P13OiXM,
306,I beo-take þe her Iosaphe,soules to kepe,Iosaphe,trochaic,Wikidata_Q6288522,n-voc,kepe,trochaic,MED24173,vi-m,
307,ȝif eni þorw þi defaute,falle fro my riche,defaute,trochaic,MED10792,n<pr,riche,trochaic,MED37437,n<pr,
308,At þe day of Iuggement,þou beost ioyned harde,Iuggement,nontrochaic,MED23992,n<pr,harde,trochaic,MED19969,av,
309,¶ I seiȝe Ioseph þi fader,schal bodiliche hem ȝeme,fader,trochaic,MED15113,n,ȝeme,trochaic,MED53835,vi,
310,And þou gostliche,nou ȝemes hem boþe,gostliche,trochaic,MED19125,av,boþe,trochaic,MED5636,ajplOd,
311,wiþ-drawe þe of þi vestimens,and do hem vp to holde,vestimens,nontrochaic,MED51067,npl<pr,holde,trochaic,MED20995,vi-m,
312,Go now to-ward þe court,þe kyng for to turne,court,nontrochaic,MED10055,n<pr,torne,trochaic,MED47404,vi-m,
313,ÞEnne þei wenden heore wei,and to þe court ȝongen,wei,dative_e,MED52010,n<pr,ȝongen,trochaic,MED18162,vpt23,
314,And al a-boute þe paleys,haly water þei spreynden,paleys,nonschwa,MED32206,n<pr,spreynden,trochaic,MED42406,vpt23,
315,for mony a wikkede gost,woned hedde þere,gost,nontrochaic,MED19121,n,þere,trochaic,MED45141,av,
316,¶ wiþ-outen on þe paleys,as þei bi passeden,paleys,nonschwa,MED32206,n<pr,passeden,trochaic,MED32556,vpt23,
317,werdes of Ebreu,weren I-writen of ȝore,Ebreu,nonschwa,MED12925,n<pr,ȝore,trochaic,MED54029,av,
318,And sein daniel of Babiloyne,whon he fro Batayle wente,Babiloyne,trochaic,Wikidata_Q5684,n<pr,wente,trochaic,MED52201,vpt13,
319,Fro nabugodonosor,þe kyng þat him hade,nabugodonosor,nonschwa,MED29001,n<pr,hade,trochaic,MED20173,vpt13,
320,called þis paleis Auntres,and forsoþe seide,Auntres,trochaic,NO_AUTH_auntres,n,seide,trochaic,MED39209,vpt13,
321,þat hit scholde trewely,in sum tyme aftur,trewely,nonschwa,MED47008,av,aftur,trochaic,MED801,av,
322,called beo þe paleis,merueilouse for werkes,paleis,nonschwa,MED32206,n,werkes,trochaic,MED52278,npl<pr,
323,þat þer scholde beo seyȝen,þorw sonde of vr lord,seyȝen,trochaic,MED39393,vSpp,lord,trochaic,MED26078,n<pr,
324,¶ Bi þat was A Messager come,after þis men sone,come,trochaic,MED8522,vSpp,sone,trochaic,MED41559,av,
325,whon þei comen to þe halle,þei maden þe signe,halle,trochaic,MED19852,n<pr,signe,trochaic,MED40259,nOd,
326,on hem of þe verrey cros,and toward þe kyng eoden,cros,dative_e,MED10442,n<pr,eoden,trochaic,MED53786,vpt23,
327,¶ þe kyng hedde geten him a clerk,on of þe beste,clerk,nontrochaic,MED7991,nOd,beste,trochaic,MED4236,ajnpl<pr,
328,nouȝwhere in heore lawe,was such a-nother holden,lawe,trochaic,MED24815,n<pr,holden,trochaic,MED20995,vSpp,
329,to take Ioseph in his tale,ȝif he wrong seide,tale,trochaic,MED44431,n<pr,seide,trochaic,MED39209,vpt13,
330,¶ þou toldest me ȝusterday quod þe kyng,þou wost wel þi-seluen,kyng,nontrochaic,MED24299,n,seluen,trochaic,MED20373,P12XN,
331,Of þise þreo persones,and alle þei beoþ goddes,persones,trochaic,MED33110,npl<pr,goddes,trochaic,MED18945,npl,
332,And siþen of a-noþer,wonder forsoþe,oþer,trochaic,MED31010,aj-indef<pr,forsoþe,trochaic,MED17159,av,
333,þat Ihesu with-outen wem,won in a Mayden,wem,dative_e,MED52187,n<pr,Mayden,trochaic,MED26501,n<pr,
334,Þat I tolde þe þo,I telle þe ȝitte,þo,nontrochaic,MED45360,av,ȝitte,trochaic,MED53930,av,
335,I nul forsake my word,for no maner þinge,word,nontrochaic,MED53418,nOd,þinge,dative_e,MED45301,n<pr,
336,Op stondes þis clerk,and seis him þise wordes,clerk,nontrochaic,MED7991,n,wordes,trochaic,MED53418,nplOd,
337,Ȝif þise þreo persones,þat þou þe fore puttest,persones,trochaic,MED33110,npl,puttest,trochaic,MED35369,vps12,
338,han bote on godhede,þei nare not goddes alle,godhede,nonschwa,MED18979,nOd,alle,trochaic,MED985,ajpl,
339,Ȝif vchon haue a godhede,I graunte bi him-selue,godhede,nonschwa,MED18979,nOd,selue,trochaic,MED20373,P13<prXM,
340,I seie þat on is also good,as þe þreo hole,good,nontrochaic,MED18947,aj,hole,trochaic,MED21007,av,
341,¶ þat on is a verrei god,I sei bi god greyþe,god,nontrochaic,MED18945,n,greyþe,trochaic,MED19346,n<pr,
342,þis oþer two nare none,in no maner þinge,none,trochaic,MED29715,pnpl,þinge,dative_e,MED45301,n<pr,
343,He sprong in his sputison,and speek harde wordes,sputison,nontrochaic,MED42472,n<pr,wordes,trochaic,MED53418,nplOd,
344,þat Ioseph hedde no space,while his speche laste,space,trochaic,MED41916,nOd,laste,trochaic,MED24729,vpt13,
345,¶ Op stondes Iosaphe,and þe fader sittes,Iosaphe,trochaic,Wikidata_Q6288522,n,sittes,trochaic,MED40572,vps13,
346,Speek wiþ an heiȝ vois,þat al þe folk herde,vois,trochaic,MED51346,n<pr,herde,trochaic,MED20505,vpt13,
347,Nou þe greteþ sir Euelak,God of israel,Euelak,nontrochaic,NO_AUTH_euelak,n-voc,israel,nontrochaic,MED23501,n<pr,
348,þorw his seruauntes mouþ,and seye þe I wile,mouþ,nontrochaic,MED28827,n<pr,wile,trochaic,MED52797,vps11,
349,¶ þou hast I-seȝe to-niht,signefies summe,to-niht,trochaic,MED46293,av,summe,trochaic,MED41466,ajplOd,
350,þow hast diskeueret hem,þer he nis not payet,hem,nontrochaic,MED20803,P23Od,payet,trochaic,MED32178,vpp,
351,Heere þou schalt ha vengaunce,verreyliche and sone,vengaunce,trochaic,MED50860,nOd,sone,trochaic,MED41559,av,
352,þat al þi reume schal seo,þat þou wrong siggest,seo,nontrochaic,MED39393,vi,siggest,trochaic,MED39209,vps12,
353,¶ For he þis ilke Tholomer,þat þou weore wont to hunte,Tholomer,nontrochaic,NO_AUTH_tholomer,n,hunte,trochaic,MED21508,vi-m,
354,þat is kyng of Babiloyne,hiderward he buskes,Babiloyne,trochaic,Wikidata_Q5684,n<pr,buskes,trochaic,MED6383,vps13,
355,þreo dayes with þe niht,nou he þe schal driue,niht,dative_e,MED29498,n<pr,driue,trochaic,MED12668,vi,
356,Siþen lacche þe atte laste,and þe þi lyf bi-reuen,laste,trochaic,MED24726,ajn<pr,bi-reuen,trochaic,MED4732,vi,
357,He þat dorste nere ȝut,þe nouȝwhere a-byde,ȝut,nontrochaic,MED53930,av,abyde,trochaic,MED88,vi,
358,nou schal winne his wille of þe,for þi wrong bi-leeue,þe,nontrochaic,MED45072,P12<pr,bi-leeue,trochaic,MED4599,n<pr,
359,¶ þenne stod vp þis clerk,and wolde eft dispuite,clerk,nontrochaic,MED7991,n,dispuite,trochaic,MED12066,vi,
360,þenne him þouȝte þat on,heold him bi þe tonge,on,nontrochaic,MED30546,pn,tonge,trochaic,MED46289,n<pr,
361,And he roungede an heiȝ,and rorede so harde,heiȝ,nontrochaic,MED20246,ajn<pr,harde,trochaic,MED19969,av,
362,his eiȝen flowen out of his hed,and biforen him fallen,hed,trochaic,MED20201,n<pr,fallen,trochaic,MED15195,vps23,
363,¶ Þenne vp sturten þe folk,and wolden wiþ wepene,folk,nontrochaic,MED16580,n,wepene,trochaic,MED52222,n<pr,
364,sle Iosep[h] and his sone,for sake* [MS forsake as in 1 185] of þis oþer,sone,trochaic,MED41557,nOd,oþer,trochaic,MED31010,pn-def<pr,
365,And þe kyng Eualac,cauȝte his swerd sone,Eualac,nontrochaic,NO_AUTH_euelak,n,sone,trochaic,MED41559,av,
366,And beo þe miht of Iubiter,he swor to hem alle,Iubiter,nontrochaic,MED24028,n<pr,alle,trochaic,MED985,ajpl<pr,
367,weore eny of heom so wood,heom forte founde,wood,trochaic,MED53255,ajpl,founde,trochaic,MED17456,vi-m,
368,he wolde felle hem feye,ar þei þenne ferden,feye,trochaic,MED15450,ajplOd,ferden,trochaic,MED15284,vpt23,
369,¶ þenne seis þe kyng,mai þer out me helpe,kyng,nontrochaic,MED24299,n,helpe,trochaic,MED20336,vi,
370,forto saue me out,ȝif þat hit so lym[p]e,out,nontrochaic,MED31059,av,lyme,trochaic,MED25633,vps13,Lawton emends b-verse
371,¶ Ȝe sire seis Iosaphe,to fonge þe trouþe,Iosaphe,trochaic,Wikidata_Q6288522,n,trouþe,trochaic,MED47016,nOd,
372,And what trouwest þou of þis mon,tides him hele,mon,nontrochaic,MED26710,n<pr,hele,trochaic,MED20307,n,
373,Gos to oure Maumetes,and proues heore mihtes,Maumetes,trochaic,MED27106,npl<pr,mihtes,trochaic,MED27708,nplOd,
374,¶ þenne þei taken þis mon,and towen him to þe temple,mon,nontrochaic,MED26710,nOd,temple,trochaic,MED44732,n<pr,
375,A-non þei brouȝten him forþ,bi-foren þe moste mayster,forþ,nontrochaic,MED17204,av,mayster,trochaic,MED26558,n<pr,
376,Calleþ vppon an ymage,þat Appollin hette,Ymage,trochaic,MED22009,n<pr,hette,trochaic,MED21307,vps13,
377,and wol not onswere a word,þauh þei scholde swelten,word,nontrochaic,MED53418,nOd,swelten,trochaic,MED44115,vi,
378,¶ þenne spekes an ymage,in a-noþer huirne,Ymage,trochaic,MED22009,n,huirne,trochaic,MED20872,n<pr,
379,þat ȝe clepeþ Martis,nouȝt is þat ȝe mene,Martis,trochaic,MED26960,nOd,mene,trochaic,MED27327,vps22,
380,Appolin is bounden,and braset so faste,bounden,trochaic,MED4667,vSpp,faste,trochaic,MED15314,av,
381,he may not speke a word,for no þing alyue,word,nontrochaic,MED53418,nOd,alyue,trochaic,MED1140,aj<pr,
382,Þenne Ioseph hente a staf,þat stod him bi-syde,staf,nontrochaic,MED42552,nOd,bi-syde,trochaic,MED4825,pr,
383,strikes to þis Appolin,with a strong wille,Appolin,nontrochaic,Wikidata_Q37340,n<pr,wille,trochaic,MED52793,n<pr,
384,þat his nekke to-barst,and brak al to pouder,to-barst,nontrochaic,MED46075,vSpt13,pouder,trochaic,MED34203,n<pr,
385,and þe fend of his bodi,fleyȝ to þe lufte,bodi,short_i,MED5376,n<pr,lufte,dative_e,MED25472,n<pr,
386,¶ þenne þei leuen him þer,and goþ touward oþure,þer,trochaic,MED45141,av,oþure,trochaic,MED31010,pnpl-def<pr,
387,¶ þe kyng bowes to his pors,him offring to beode,pors,nontrochaic,MED35297,n<pr,beode,trochaic,MED3881,vi-m,
388,Let beo seis Iosaphe,I leeue þe beo bettre,Iosaphe,trochaic,Wikidata_Q6288522,n,bettre,trochaic,MED4287,aj-cpv,
389,For and þou profre him eny,I schal do [þe] to preue,eny,short_i,MED1643,pnOd,preue,trochaic,MED34580,n<pr,
390,vppon sodeyne deþ,þou schalt sone dye,deþ,dative_e,MED11421,n<pr,dye,trochaic,MED11564,vi,
391,¶ Do tel me seis þe kyng,I haue þe muche truste,kyng,nontrochaic,MED24299,n,truste,trochaic,MED47300,vpp,
392,Of þis tholomer and me,hou schal hit tyden,me,nontrochaic,MED27132,P11<pr,tyden,trochaic,MED45773,vi,
393,And he onsweres aȝeyn,I dar not wel sigge,aȝeyn,nontrochaic,MED3328,av,sigge,trochaic,MED39209,vi,
394,for þis cristene men,þat vmbe mong ȝongen,men,nontrochaic,MED26710,npl<pr,ȝongen,trochaic,MED18162,vps23,
395,¶ Se ȝe not þe tweyne Angeles,leden hem a-boute,Angeles,trochaic,MED3046,nplOd,a-boute,trochaic,MED160,av,
396,¶ þat on bereþ a cros,þat oþer a swerd kene,cros,nontrochaic,MED10442,nOd,kene,trochaic,MED24148,ajOd,
397,¶ wher-so-euere þei ben stad,such is heore strengþe,stad,nontrochaic,MED42719,vpp,strengþe,trochaic,MED43299,n,
398,Vre maystrie is nouȝt,in no maner þinge,nouȝt,nontrochaic,MED29935,av,þinge,dative_e,MED45301,n<pr,
399,¶ þenne seis Iosaphe,for us ne schalt þou wonde,Iosaphe,trochaic,Wikidata_Q6288522,n,wonde,trochaic,MED53374,vi,
400,Vppon þe heiȝe trinite,I halse þe to telle,trinite,nontrochaic,MED47107,n<pr,telle,trochaic,MED44693,vi-m,
401,Spek al þat þou const,& let þe kyng here,const,nontrochaic,MED9326,vps12,here,trochaic,MED20505,vi,
402,Of newe þing þat is to come he seis,con I not telle,seis,nontrochaic,MED39209,vps13,telle,trochaic,MED44693,vi,
403,Bi þat was a Messager i-come,and to þe kyng menes,i-come,trochaic,MED8522,vSpp,menes,trochaic,MED27327,vps13,
404,And seis him þat tholomer,has taken of his londes,tholomer,nontrochaic,NO_AUTH_tholomer,n,londes,trochaic,MED25988,npl<pr,
405,¶ þe riche Cite of Nagister,nomen he has forsoþe,Nagister,nontrochaic,NO_AUTH_nagister,n<pr,for-soþe,trochaic,MED17159,av,
406,Siþen he keueres vppon,and takes bi-fore clene,vppon,nontrochaic,MED50462,av,clene,trochaic,MED7951,av,
407,þe Castel of a-longines,and hiderward he ioynes,a-longines,?,NO_AUTH_alongines,n<pr,ioynes,trochaic,MED23893,vps13,
408,with sixti þousent he seide,of clene men of Armes,seide,trochaic,MED39209,vpt13,Armes,trochaic,MED2266,npl<pr,
409,And Fifti þousend fot-men,þat redi beþ to fihte,fot-men,nontrochaic,MED17420,npl<pr,fihte,trochaic,MED15910,vi-m,
410,þei han geten þat holt,for certeyn soþe,host,nontrochaic,MED21276,nOd,soþe,dative_e,MED41701,n<pr,
411,þer is non in þat lond,þat schal hem wiþstonden,lond,dative_e,MED25988,n<pr,wiþstonden,trochaic,MED53147,vi,
412,¶ þenne þe kyng was a-ferd,I hete þe forsoþe,aferd,trochaic,MED665,vpp-aj,forsoþe,trochaic,MED17159,av,
413,leste þe tale of Iosaphe,ferede trewe,Iosaphe,trochaic,Wikidata_Q6288522,n<pr,trewe,trochaic,MED46999,aj,
414,ÞE kyng boskes lettres a-non,to bounen his bernes,anon,nontrochaic,MED1714,av,bernes,trochaic,MED4195,nplOd,
415,Comaundes hem to meeten him,tymely on þe morwen,him,nontrochaic,MED20803,P13MOd,morwen,trochaic,MED28660,n<pr,
416,At þe Castel of Carboye,þer he beden hade,Carboye,?,NO_AUTH_carboye,n<pr,hade,trochaic,MED20173,vpt13,
417,was fiftene myle,fro sarras I-holden,myle,trochaic,MED27759,n,I-holden,trochaic,MED20995,vSpp,
418,And oþer fiftene myle,fro þenne as þei leiȝen,myle,trochaic,MED27759,n,leiȝen,trochaic,MED25443,vSpt23,
419,¶ þenne Ioseph takes him forþ,and seiþ him þis wordes,forþ,nontrochaic,MED17204,av,wordes,trochaic,MED53418,nplOd,
420,wostou what þou do kyng,nou þat þou wendes,kyng,nontrochaic,MED24299,n-voc,wendes,trochaic,MED52201,vps13,
421,Of þi comynge a-ȝein,const þou not telle,aȝein,nontrochaic,MED3328,av,telle,trochaic,MED44693,vi,
422,¶ Such signe me is tauȝt,þou art of cun symple,tauȝt,nontrochaic,MED44633,vpp,symple,trochaic,MED40392,aj<pr,
423,forsoþe A mon was þi fader,þat couþe schon a-mende,fader,trochaic,MED15113,n,amende,trochaic,MED1394,vi,
424,¶ þat tyme þat Augustes cesar,was Emperour of Rome,cesar,nonschwa,MED7154,n,Rome,trochaic,MED37821,n<pr,
425,þou wast lenged in þe lond,þat þat lord ouȝte,lond,dative_e,MED25988,n<pr,ouȝte,trochaic,MED31051,vpt13,
426,Fourti knihtes douȝtres,he wolde haue of fraunce,douȝtres,trochaic,MED12455,nplOd,fraunce,trochaic,MED17594,n<pr,
427,forte souwe selk-werk,and sitten in his chaumbre,werk,nontrochaic,MED52278,nOd,chaumbre,trochaic,MED7346,n<pr,
428,¶ For þou were a feir child,þou weore I-fet to serue,child,nontrochaic,MED7559,n,serue,trochaic,MED39583,vi-m,
429,twei feire maydenes,and wiþ þis mon lengedest,maydenes,trochaic,MED26501,nplOd,lengedest,trochaic,MED25116,vpt12,
430,¶ þei heolden þe of herre blod,þen þou boren weore,blod,trochaic,MED5268,n<pr,weore,trochaic,MED4048,vsjpt12,
431,So þou souȝtes fro him,to þe erl of Surye,him,nontrochaic,MED20803,P13M<pr,surye,trochaic,MED40515,n<pr,
432,So þou and his sone,vppon a day seten,sone,trochaic,MED41557,n<pr,seten,trochaic,MED40572,vSpt23,
433,And ȝe woxen vn-sauȝt,and þou slouȝ him þere,vnsauȝt,nontrochaic,MED49640,vpp,þere,trochaic,MED45141,av,
434,So þou come to þe kyng,þat þis kuþþe auȝte,kyng,dative_e,MED24299,n<pr,auȝte,trochaic,MED31051,vpt13,
435,Seidest þou were a kniht,and in his court laftest,kniht,nontrochaic,MED24418,n,laftest,trochaic,MED25339,vpt12,
436,¶ He was an old mon,weried of werre,mon,nontrochaic,MED26710,n,werre,trochaic,MED52312,n<pr,
437,And þou weore a ȝong mon,in þi grete strengþe,mon,nontrochaic,MED26710,n,strengþe,trochaic,MED43299,n<pr,
438,For þou toke his enemy,and brouȝtest him to honde,enemy,nontrochaic,MED13741,nOd,honde,dative_e,MED21102,n<pr,
439,forþi he ȝaf þe þis lond,after his lyue,lond,nontrochaic,MED25988,nOd,lyue,dative_e,MED25454,n<pr,
440,Hit is not allynge to carpe sire kyng,wher-of we comen,kyng,nontrochaic,MED24299,n-voc,comen,trochaic,MED8522,vps21,Lawton emends b-verse
441,He takes non [hede] heere-to,bote askes him of þe sweuene,heere-to,nontrochaic,MED20630,av,sweuene,trochaic,MED44177,n<pr,
442,þat he mette on þe niht,and bad he scholde him telle,niht,dative_e,MED29498,n<pr,telle,trochaic,MED44693,vi,
443,¶ whon þat þou comest aȝeyn,wite þou schalt forsoþe,aȝeyn,nontrochaic,MED3328,av,forsoþe,trochaic,MED17159,av,
444,þou miht haue more redi roume,my rikenyng to here,roume,nontrochaic,MED37971,nOd,here,trochaic,MED20505,vi-m,
445,¶ Ioseph[e] takes his scheld,and schapes a-middes,scheld,nontrochaic,MED39833,nOd,a-middes,trochaic,MED1431,av,
446,A crois of red cloþ,and kennes him aftur,cloþ,nontrochaic,MED8138,n<pr,aftur,trochaic,MED801,av,
447,whon his peril weore most,to crist he scholde preyen,most,nontrochaic,MED28737,aj-sup,preyen,trochaic,MED34400,vi,
448,for þer scholde no mon verreili,þat vigore bi-holden,verreili,nontrochaic,MED50989,av,bi-holden,trochaic,MED4526,vi,
449,þat he nis saaf þat dai,and his sore passed,dai,nontrochaic,MED10482,nOi,passed,trochaic,MED32556,vpp,
450,ÞEnne he buskes touward þe bente,þer þis oþer byden,bente,dative_e,MED4116,n<pr,byden,trochaic,MED4389,vps23,
451,He arayes his riche men,and rihtes hem swiþe,men,nontrochaic,MED26710,nplOd,swiþe,trochaic,MED44277,av,
452,A-non tholomers men,woxen þe biggore,men,nontrochaic,MED26710,npl,biggore,trochaic,MED4441,ajnpl-cpv,
453,sone beeren hem a-bac,and brouhten hem to grounde,a-bac,nontrochaic,MED26,av,grounde,dative_e,MED19601,n<pr,
454,And þei tornede a-ȝein,þat tyme hit was non oþer,aȝein,nontrochaic,MED3328,av,oþer,trochaic,MED31010,pn-def,
455,¶ þei come bi tholomers tentes,vn-housed hem sone,tentes,trochaic,MED44838,npl<pr,sone,trochaic,MED41559,av,
