line,text_a,text_b,item_a,prosodel_a,lexel_a,grammel_a,item_b,prosodel_b,lexel_b,grammel_b,notes
685,he was þe forme þat day,þat fongede trouþe,day,trochaic,MED10482,n<pr,trouþe,trochaic,MED47016,nOd,
686,¶ whon he Baptised was,þis oþere bi-heolden,was,nontrochaic,MED4048,vpt13,bi-heolden,trochaic,MED4526,vSpt23,
687,Heom þouȝte he leomede as liht,al on a lowe,liht,nontrochaic,MED25497,n,lowe,trochaic,MED26183,n<pr,
688,¶ þei seȝen þe holy-gost,at his mouþ descenden,holy gost,nontrochaic,MED21027,n,descenden,trochaic,MED11268,vi,
689,And he speek þenne,þat bi-foren ne kneuȝ,þenne,trochaic,MED45038,av,kneuȝ,nontrochaic,MED24477,vSpt13,
690,ÞEnne com he wiþ þe sore Arm,þat þorw þe grace was holpen,Arm,nontrochaic,MED2259,n<pr,holpen,trochaic,MED20336,vSpp,
691,In þe nome of þe fader,Ioseph him folwed,fader,trochaic,MED15113,n<pr,folwed,trochaic,MED17944,vpt13,
692,clepen him Cleomadas,and callen him after,Cleomadas,nontrochaic,NO_AUTH_cleomadas,n,after,trochaic,MED801,av,
693,¶ þenne com þe kyng Eualac,and fullouht askes,Eualac,nontrochaic,NO_AUTH_euelak,n,askes,trochaic,MED2480,vps13,
694,In þe nome of þe fader,Ioseph him folwede,fader,trochaic,MED15113,n<pr,folwede,trochaic,MED17944,vpt13,
695,Called him Mordreyns,a lat mon in trouþe,Mordreyns,nonschwa,NO_AUTH_mordreyns,n,trouþe,trochaic,MED47016,n<pr,
696,¶ þen com þe folk,to Iosaphe so þikke,folk,nontrochaic,MED16580,n,þikke,trochaic,MED45270,av,
697,He tok a basin of gold,in boþe two his hondes,gold,dative_e,MED19031,n<pr,hondes,trochaic,MED21102,npl<pr,
698,Vppon þe heiȝe trinite,he let water hiȝe,trinite,nontrochaic,MED47107,n<pr,hiȝe,trochaic,MED20768,vi,
699,And hedde fulwed bi non,mo þen fyue þousend,non,dative_e,MED29714,n<pr,þousend,trochaic,MED45417,qc<pr,"THAN is quasi prep: MED s.v. ‘than, conj.’ sense 8"
700,¶ þenn seis Iosaphe,þat Ioseph his fader,Iosaphe,trochaic,Wikidata_Q6288522,n,fader,trochaic,MED15113,n,
701,mot a-byden him,and dwelle þer stille,him,nontrochaic,MED20803,P13OdM,stille,trochaic,MED42950,av,
702,¶ while þat he and Naciens gon,nouþer þei nusten,gon,nontrochaic,MED19078,vps23,nusten,trochaic,MED52987,vpt23,
703,forte cristene þe folk,and casten þe false,folk,nontrochaic,MED16580,nOd,false,trochaic,MED15202,ajnplOd,
704,¶ But þere an vnsely kyng,in prison hem caste,kyng,nontrochaic,MED24299,n,caste,trochaic,MED6914,vpt13,
705,wiþ muche serwe to him-self,siker atte laste,self,nontrochaic,MED20373,P13<prXM,laste,trochaic,MED24726,ajn<pr,
706,¶ For þe kyng Mordreyns,com with such strengþe,Mordreyns,nonschwa,NO_AUTH_mordreyns,n,strengþe,trochaic,MED43299,n<pr,
707,forte liuere hem out,on lyue he lafte none,out,nontrochaic,MED31168,av,none,trochaic,MED29715,pnplOd,
708,¶ Siþen þei bi-tauȝten þe blod,twei burnes to holden,blod,nontrochaic,MED5268,nOd,holden,trochaic,MED20995,vi-m,
709,And þei lenden of þe toun,and leuen hit þere,toun,trochaic,MED46572,n<pr,þere,trochaic,MED45141,av,
